{
  "schema_version": "1.0",
  "name": "research-to-project-validation",
  "description": "Establish current evidence, then test only the technical claims named by the assignment.",
  "explicit_selection_required": true,
  "roles": ["research", "project-validation"],
  "automatic_handoff": {
    "minimum_confidence": "medium",
    "every_load_bearing_claim_minimum_confidence": "medium",
    "observable_rubric": "procedures/confidence.md",
    "requires_current_role_success": true,
    "preserve": ["evidence_refs", "provenance", "uncertainty"],
    "stay_within_original_assignment": true
  },
  "handoff_never_approves": [
    "spending",
    "sensitive access",
    "destructive behavior",
    "production deployment",
    "unrequested product construction"
  ]
}
